id;flag;name;text;origin;goal;main
1;!SLEPT_INVASION;Eine wichtige Angelegenheit;Laut Vater möchte Wächter Krosso mir etwas Wichtiges mitteilen. Besser, ich suche ihn rasch auf.;Kerstil_0$511977843;onTalk:Kerstil$2114996193;1
2;;Schließt die Tore im Westen!;Die offensichtlich feindseligen Reiter kommen immer näher. Von Wächter Krosso wurde mir aufgetragen, die Palisade im Westen zu versprerren.;Kerstil$2114996193;;1
3;;Schließt die Tore im Norden!;Die offensichtlich feindseligen Reiter kommen immer näher. Von Wächter Krosso wurde mir aufgetragen, die Palisade im Norden zu versprerren.;Kerstil$2114996193;;1
4;;Zu den Waffen!;Wächter Krosso trug mir außerdem auf, die Mitbewohner über die Lage zu informieren und mich zu bewaffnen.;Kerstil$2114996193;;1
5;;Alles erledigt;Wächter Krosso war so gütig, mir zu erlauben, nach den Aufgaben wieder heim zu gehen.;Kerstil$2114996193;onTalk:Kerstil_0$511977843;1
6;SLEPT_INVASION;Das Dorf in Flammen;Wir müssen fliehen, diese Räuber haben das Dorf in Brand gesteckt!;Kerstil_0$511977843;;1
